<?xml version="1.0" encoding="utf-8" ?>
<menuDataStores
	xmlns:xsi='http://www.w3.org/2001/XMLSchema-instance'
	xsi:noNamespaceSchemaLocation="http://oroptimizer.com/ExtendibleTreeStructure/TestsXmlSchemas/MenuDataStoresSchema.xsd">
	<menuDataStore id="SharedMenuObjects">
		<menuItem commandId="Projects"/>
		<menuItem commandId="Errors" parentId="ExtendibleTreeStructure.Tests.CommandIds.Projects"/>

		<menuItem commandId="SaveFile"/>
		<menuItem commandId="SaveFileAs" parentId="ExtendibleTreeStructure.Tests.CommandIds.SaveFile"/>
	</menuDataStore>

	<menuDataStore id="SharedMenuObjects2">
		<copyMenuObject referencedMenuDataStoreId="RecentObjectsGroup" 
		                referencedMenuObjectId="ExtendibleTreeStructure.Tests.CommandIds.Projects"/>
		<copyMenuObject referencedMenuDataStoreId="SharedMenuObjects" 
		                referencedMenuObjectId="ExtendibleTreeStructure.Tests.CommandIds.EncodingUtf8"/>

		<menuBarItem commandId="BuildMenuBarItem"/>
		<copyMenuObject referencedMenuDataStoreId="RecentObjectsGroup" 
		                referencedMenuObjectId="ExtendibleTreeStructure.Tests.CommandIds.BuildProject" 
		                parentId="ExtendibleTreeStructure.Tests.CommandIds.BuildMenuBarItem"/>
		
		<copyMenuObject referencedMenuDataStoreId="SharedMenuObjects" 
		                referencedMenuObjectId="ExtendibleTreeStructure.Tests.CommandIds.BuildSolution"
		                parentId="ExtendibleTreeStructure.Tests.CommandIds.BuildMenuBarItem" />
	</menuDataStore>

	<menuDataStore id="NoFileSelectedMenuObjects">
		<copyMenuObject referencedMenuDataStoreId="SharedMenuObjects2" 
		                referencedMenuObjectId="ExtendibleTreeStructure.Tests.CommandIds.EncodingUtf8"/>

		<menuBarItem commandId="BuildMenuBarItem"/>
		<copyMenuObject referencedMenuDataStoreId="SharedMenuObjects2"
		                referencedMenuObjectId="ExtendibleTreeStructure.Tests.CommandIds.BuildSolution"
		                parentId="ExtendibleTreeStructure.Tests.CommandIds.BuildMenuBarItem" />
		
	</menuDataStore>
	
</menuDataStores>