<?xml version="1.0" encoding="utf-8" ?>
<menuDataStores
	xmlns:xsi='http://www.w3.org/2001/XMLSchema-instance'
	xsi:noNamespaceSchemaLocation="http://oroptimizer.com/ExtendibleTreeStructure/TestsXmlSchemas/MenuDataStoresSchema.xsd">
	<menuDataStore id="SharedMenuObjects">
		<menuItemCollection id="RecentObjectsCollection" usesMenuSeparator="true" />

		<menuItem commandId="RecentFiles" parentId="RecentObjectsCollection" />
		<menuItem commandId="RecentlyChangedFiles" parentId="RecentObjectsCollection" />
	</menuDataStore>

	<menuDataStore id="SharedMenuObjects2">
		<menuBarItem commandId="ViewMenuBarItem"/>

		<!--1. Copy RecentObjectsCollection item from SharedMenuObjects (along with its children) data store as a child 
		of ViewMenuBarItem in this store 
		-->
		<copyMenuObject referencedMenuDataStoreId="SharedMenuObjects" referencedMenuObjectId="RecentObjectsCollection"
		                parentId="ExtendibleTreeStructure.Tests.CommandIds.ViewMenuBarItem" />

		<!--2. Add new children to copied RecentObjectsCollection-->
		<menuItem commandId="RecentChanges" parentId="RecentObjectsCollection" />
	</menuDataStore>

	<menuDataStore id="NoFileSelectedMenuObjects">
		<menuBar id="NoFileSelectedDefaultMenuBar" />
		<menuBarItem commandId="FileMenuBarItem" parentMenuBarId="NoFileSelectedDefaultMenuBar"/>

		<!--Copy RecentObjectsCollection from SharedMenuObjects2 data store (which in turn was copied from SharedMenuObjects2 into SharedMenuObjects2)
		as a child of FileMenuBarItem-->
		<copyMenuObject referencedMenuDataStoreId="SharedMenuObjects2" referencedMenuObjectId="RecentObjectsCollection"
		                parentId="ExtendibleTreeStructure.Tests.CommandIds.FileMenuBarItem" />

		<!--2. Add new children to copied RecentObjectsCollection-->
		<menuItem commandId="RecentLocations" parentId="RecentObjectsCollection" />
		<menuItem commandId="RecentSubmissions" parentId="RecentObjectsCollection" />

		<!--3. 'Errors' menu item will be added as a child to RecentChanges that is a child of 
			RecentObjectsCollection in SharedMenuObjects2. Since RecentObjectsCollection and its children are copied from SharedMenuObjects2
			we can add new children to RecentObjectsCollection as well as any of its children (or children of children, etc).
		-->
		<menuItem commandId="Errors" parentId="ExtendibleTreeStructure.Tests.CommandIds.RecentChanges" />
	</menuDataStore>
</menuDataStores>