<?xml version="1.0" encoding="utf-8" ?>
<menuDataStores
	xmlns:xsi='http://www.w3.org/2001/XMLSchema-instance'
	xsi:noNamespaceSchemaLocation="http://oroptimizer.com/ExtendibleTreeStructure/TestsXmlSchemas/MenuDataStoresSchema.xsd">
	<menuDataStore id="SharedMenuObjects">
		<menuItem commandId="Errors"/>
	</menuDataStore>

	<menuDataStore id="SharedMenuObjects">
		<menuItem commandId="EnterFullScreenMode"/>
	</menuDataStore>

	<menuDataStore id="SharedMenuObjects2">
		<menuItem commandId="Projects"/>
		<copyMenuObject referencedMenuDataStoreId="SharedMenuObjects"
		                referencedMenuObjectId="ExtendibleTreeStructure.Tests.CommandIds.Errors"
		                parentId="ExtendibleTreeStructure.Tests.CommandIds.Projects"/>
	</menuDataStore>
</menuDataStores>