<?xml version="1.0" encoding="utf-8" ?>
<menuDataStores
	xmlns:xsi='http://www.w3.org/2001/XMLSchema-instance'
	xsi:noNamespaceSchemaLocation="http://oroptimizer.com/ExtendibleTreeStructure/TestsXmlSchemas/MenuDataStoresSchema.xsd">
	<menuDataStore id="SharedMenuObjects">
		<menuItem commandId="Projects"/>
		<menuItem commandId="Errors" parentId="ExtendibleTreeStructure.Tests.CommandIds.Projects"/>

		<!--Git cannot be used as top level data store item (per override of DataStoresCache.IsValidTopLevelDataStoreItem(dataStoreItem))
			Therefore,  item will be removed.
		-->
		<menuItem commandId="Git"/>
		<menuItem commandId="RecentSubmissions" parentId="ExtendibleTreeStructure.Tests.CommandIds.Git"/>
	</menuDataStore>

	<menuDataStore id="SharedMenuObjects2">
		<copyMenuObject referencedMenuDataStoreId="SharedMenuObjects" referencedMenuObjectId="ExtendibleTreeStructure.Tests.CommandIds.Projects"/>

		<!--Git cannot be used as top level data store item (per override of DataStoresCache.IsValidTopLevelDataStoreItem(dataStoreItem))
			Therefore, this item will be removed.
		-->
		<copyMenuObject referencedMenuDataStoreId="SharedMenuObjects" referencedMenuObjectId="ExtendibleTreeStructure.Tests.CommandIds.Git"/>
	</menuDataStore>

	<menuDataStore id="NoFileSelectedMenuObjects">
		<menuBarItem commandId="FileMenuBarItem"/>

		<!--Git cannot be used as top level data store item (per override of DataStoresCache.IsValidTopLevelDataStoreItem(dataStoreItem))
			However, in this case, Git is top level ExtendibleTreeStructure.Tests.CommandIds.Git in SharedMenuObjects, however
			it is copied as child of FileMenuBarItem. Therefore, Git will not be removed in this data store.
		-->
		<copyMenuObject referencedMenuDataStoreId="SharedMenuObjects" 
		                referencedMenuObjectId="ExtendibleTreeStructure.Tests.CommandIds.Git"
		                parentId="ExtendibleTreeStructure.Tests.CommandIds.FileMenuBarItem"/>
		
	</menuDataStore>
	
</menuDataStores>